{
	"artifacts" : 
	[
		{
			"path" : "utils/TableGen/CMakeFiles/obj.LLVMTableGenCommon.dir/Attributes.cpp.o"
		},
		{
			"path" : "utils/TableGen/CMakeFiles/obj.LLVMTableGenCommon.dir/CodeGenIntrinsics.cpp.o"
		},
		{
			"path" : "utils/TableGen/CMakeFiles/obj.LLVMTableGenCommon.dir/DirectiveEmitter.cpp.o"
		},
		{
			"path" : "utils/TableGen/CMakeFiles/obj.LLVMTableGenCommon.dir/IntrinsicEmitter.cpp.o"
		},
		{
			"path" : "utils/TableGen/CMakeFiles/obj.LLVMTableGenCommon.dir/RISCVTargetDefEmitter.cpp.o"
		},
		{
			"path" : "utils/TableGen/CMakeFiles/obj.LLVMTableGenCommon.dir/SDNodeProperties.cpp.o"
		},
		{
			"path" : "utils/TableGen/CMakeFiles/obj.LLVMTableGenCommon.dir/VTEmitter.cpp.o"
		}
	],
	"backtrace" : 3,
	"backtraceGraph" : 
	{
		"commands" : 
		[
			"add_library",
			"llvm_add_library",
			"add_llvm_library",
			"set_property",
			"llvm_update_compile_flags",
			"add_compile_definitions",
			"include",
			"include_directories",
			"target_include_directories"
		],
		"files" : 
		[
			"cmake/modules/AddLLVM.cmake",
			"utils/TableGen/CMakeLists.txt",
			"cmake/modules/HandleLLVMOptions.cmake",
			"CMakeLists.txt"
		],
		"nodes" : 
		[
			{
				"file" : 1
			},
			{
				"command" : 2,
				"file" : 1,
				"line" : 3,
				"parent" : 0
			},
			{
				"command" : 1,
				"file" : 0,
				"line" : 852,
				"parent" : 1
			},
			{
				"command" : 0,
				"file" : 0,
				"line" : 519,
				"parent" : 2
			},
			{
				"command" : 4,
				"file" : 0,
				"line" : 522,
				"parent" : 2
			},
			{
				"command" : 3,
				"file" : 0,
				"line" : 83,
				"parent" : 4
			},
			{
				"file" : 3
			},
			{
				"command" : 6,
				"file" : 3,
				"line" : 926,
				"parent" : 6
			},
			{
				"file" : 2,
				"parent" : 7
			},
			{
				"command" : 5,
				"file" : 2,
				"line" : 92,
				"parent" : 8
			},
			{
				"command" : 5,
				"file" : 2,
				"line" : 113,
				"parent" : 8
			},
			{
				"command" : 5,
				"file" : 2,
				"line" : 1053,
				"parent" : 8
			},
			{
				"command" : 5,
				"file" : 2,
				"line" : 1054,
				"parent" : 8
			},
			{
				"command" : 5,
				"file" : 2,
				"line" : 1055,
				"parent" : 8
			},
			{
				"command" : 7,
				"file" : 3,
				"line" : 1133,
				"parent" : 6
			},
			{
				"command" : 8,
				"file" : 0,
				"line" : 534,
				"parent" : 2
			}
		]
	},
	"compileGroups" : 
	[
		{
			"compileCommandFragments" : 
			[
				{
					"fragment" : " -fPIC -fvisibility-inlines-hidden -Werror=date-time -Werror=unguarded-availability-new -Wall -Wextra -Wno-unused-parameter -Wwrite-strings -Wcast-qual -Wmissing-field-initializers -pedantic -Wno-long-long -Wc++98-compat-extra-semi -Wimplicit-fallthrough -Wcovered-switch-default -Wno-noexcept-type -Wnon-virtual-dtor -Wdelete-non-virtual-dtor -Wsuggest-override -Wstring-conversion -Wmisleading-indentation -Wctad-maybe-unsupported -g -std=c++17 -arch arm64 -isysroot /Applications/Xcode.app/Contents/Developer/Platforms/MacOSX.platform/Developer/SDKs/MacOSX14.0.sdk"
				},
				{
					"fragment" : " -fno-exceptions -funwind-tables -fno-rtti"
				}
			],
			"defines" : 
			[
				{
					"backtrace" : 5,
					"define" : "GTEST_HAS_RTTI=0"
				},
				{
					"backtrace" : 9,
					"define" : "_DEBUG"
				},
				{
					"backtrace" : 10,
					"define" : "_GLIBCXX_ASSERTIONS"
				},
				{
					"backtrace" : 11,
					"define" : "__STDC_CONSTANT_MACROS"
				},
				{
					"backtrace" : 12,
					"define" : "__STDC_FORMAT_MACROS"
				},
				{
					"backtrace" : 13,
					"define" : "__STDC_LIMIT_MACROS"
				}
			],
			"includes" : 
			[
				{
					"path" : "/Users/jacsc/Code/install/llvm-build/utils/TableGen"
				},
				{
					"path" : "/Users/jacsc/Code/install/llvm-project/llvm/utils/TableGen"
				},
				{
					"backtrace" : 14,
					"path" : "/Users/jacsc/Code/install/llvm-build/include"
				},
				{
					"backtrace" : 14,
					"path" : "/Users/jacsc/Code/install/llvm-project/llvm/include"
				},
				{
					"backtrace" : 15,
					"path" : "/opt/homebrew/include"
				}
			],
			"language" : "CXX",
			"languageStandard" : 
			{
				"backtraces" : 
				[
					3
				],
				"standard" : "17"
			},
			"sourceIndexes" : 
			[
				0,
				1,
				2,
				3,
				4,
				5,
				6
			]
		}
	],
	"folder" : 
	{
		"name" : "Object Libraries"
	},
	"id" : "obj.LLVMTableGenCommon::@dca47d54282c16282dfc",
	"name" : "obj.LLVMTableGenCommon",
	"paths" : 
	{
		"build" : "utils/TableGen",
		"source" : "utils/TableGen"
	},
	"sourceGroups" : 
	[
		{
			"name" : "Source Files",
			"sourceIndexes" : 
			[
				0,
				1,
				2,
				3,
				4,
				5,
				6
			]
		},
		{
			"name" : "Header Files",
			"sourceIndexes" : 
			[
				7,
				8,
				9,
				10,
				11,
				12,
				13,
				14,
				15,
				16,
				17,
				18,
				19,
				20,
				21,
				22,
				23,
				24,
				25,
				26,
				27,
				28,
				29,
				30,
				31,
				32,
				33
			]
		}
	],
	"sources" : 
	[
		{
			"backtrace" : 3,
			"compileGroupIndex" : 0,
			"path" : "utils/TableGen/Attributes.cpp",
			"sourceGroupIndex" : 0
		},
		{
			"backtrace" : 3,
			"compileGroupIndex" : 0,
			"path" : "utils/TableGen/CodeGenIntrinsics.cpp",
			"sourceGroupIndex" : 0
		},
		{
			"backtrace" : 3,
			"compileGroupIndex" : 0,
			"path" : "utils/TableGen/DirectiveEmitter.cpp",
			"sourceGroupIndex" : 0
		},
		{
			"backtrace" : 3,
			"compileGroupIndex" : 0,
			"path" : "utils/TableGen/IntrinsicEmitter.cpp",
			"sourceGroupIndex" : 0
		},
		{
			"backtrace" : 3,
			"compileGroupIndex" : 0,
			"path" : "utils/TableGen/RISCVTargetDefEmitter.cpp",
			"sourceGroupIndex" : 0
		},
		{
			"backtrace" : 3,
			"compileGroupIndex" : 0,
			"path" : "utils/TableGen/SDNodeProperties.cpp",
			"sourceGroupIndex" : 0
		},
		{
			"backtrace" : 3,
			"compileGroupIndex" : 0,
			"path" : "utils/TableGen/VTEmitter.cpp",
			"sourceGroupIndex" : 0
		},
		{
			"backtrace" : 3,
			"path" : "utils/TableGen/AsmWriterInst.h",
			"sourceGroupIndex" : 1
		},
		{
			"backtrace" : 3,
			"path" : "utils/TableGen/CodeGenDAGPatterns.h",
			"sourceGroupIndex" : 1
		},
		{
			"backtrace" : 3,
			"path" : "utils/TableGen/CodeGenHwModes.h",
			"sourceGroupIndex" : 1
		},
		{
			"backtrace" : 3,
			"path" : "utils/TableGen/CodeGenInstAlias.h",
			"sourceGroupIndex" : 1
		},
		{
			"backtrace" : 3,
			"path" : "utils/TableGen/CodeGenInstruction.h",
			"sourceGroupIndex" : 1
		},
		{
			"backtrace" : 3,
			"path" : "utils/TableGen/CodeGenIntrinsics.h",
			"sourceGroupIndex" : 1
		},
		{
			"backtrace" : 3,
			"path" : "utils/TableGen/CodeGenRegisters.h",
			"sourceGroupIndex" : 1
		},
		{
			"backtrace" : 3,
			"path" : "utils/TableGen/CodeGenSchedule.h",
			"sourceGroupIndex" : 1
		},
		{
			"backtrace" : 3,
			"path" : "utils/TableGen/CodeGenTarget.h",
			"sourceGroupIndex" : 1
		},
		{
			"backtrace" : 3,
			"path" : "utils/TableGen/DAGISelMatcher.h",
			"sourceGroupIndex" : 1
		},
		{
			"backtrace" : 3,
			"path" : "utils/TableGen/DFAEmitter.h",
			"sourceGroupIndex" : 1
		},
		{
			"backtrace" : 3,
			"path" : "utils/TableGen/GlobalISelMatchTable.h",
			"sourceGroupIndex" : 1
		},
		{
			"backtrace" : 3,
			"path" : "utils/TableGen/GlobalISelMatchTableExecutorEmitter.h",
			"sourceGroupIndex" : 1
		},
		{
			"backtrace" : 3,
			"path" : "utils/TableGen/InfoByHwMode.h",
			"sourceGroupIndex" : 1
		},
		{
			"backtrace" : 3,
			"path" : "utils/TableGen/OptEmitter.h",
			"sourceGroupIndex" : 1
		},
		{
			"backtrace" : 3,
			"path" : "utils/TableGen/PredicateExpander.h",
			"sourceGroupIndex" : 1
		},
		{
			"backtrace" : 3,
			"path" : "utils/TableGen/SDNodeProperties.h",
			"sourceGroupIndex" : 1
		},
		{
			"backtrace" : 3,
			"path" : "utils/TableGen/SequenceToOffsetTable.h",
			"sourceGroupIndex" : 1
		},
		{
			"backtrace" : 3,
			"path" : "utils/TableGen/SubtargetFeatureInfo.h",
			"sourceGroupIndex" : 1
		},
		{
			"backtrace" : 3,
			"path" : "utils/TableGen/TableGenBackends.h",
			"sourceGroupIndex" : 1
		},
		{
			"backtrace" : 3,
			"path" : "utils/TableGen/Types.h",
			"sourceGroupIndex" : 1
		},
		{
			"backtrace" : 3,
			"path" : "utils/TableGen/VarLenCodeEmitterGen.h",
			"sourceGroupIndex" : 1
		},
		{
			"backtrace" : 3,
			"path" : "utils/TableGen/WebAssemblyDisassemblerEmitter.h",
			"sourceGroupIndex" : 1
		},
		{
			"backtrace" : 3,
			"path" : "utils/TableGen/X86DisassemblerShared.h",
			"sourceGroupIndex" : 1
		},
		{
			"backtrace" : 3,
			"path" : "utils/TableGen/X86DisassemblerTables.h",
			"sourceGroupIndex" : 1
		},
		{
			"backtrace" : 3,
			"path" : "utils/TableGen/X86ModRMFilters.h",
			"sourceGroupIndex" : 1
		},
		{
			"backtrace" : 3,
			"path" : "utils/TableGen/X86RecognizableInstr.h",
			"sourceGroupIndex" : 1
		}
	],
	"type" : "OBJECT_LIBRARY"
}
