{
	"artifacts" : 
	[
		{
			"path" : "bin/llvm-yaml-parser-fuzzer"
		}
	],
	"backtrace" : 3,
	"backtraceGraph" : 
	{
		"commands" : 
		[
			"add_executable",
			"add_llvm_executable",
			"add_llvm_fuzzer",
			"target_link_libraries",
			"explicit_llvm_config",
			"llvm_config",
			"LLVMBuildResolveComponentsLink",
			"llvm_add_library",
			"add_llvm_library",
			"add_llvm_component_library",
			"set_property",
			"llvm_update_compile_flags",
			"add_compile_definitions",
			"include",
			"include_directories"
		],
		"files" : 
		[
			"cmake/modules/AddLLVM.cmake",
			"tools/llvm-yaml-parser-fuzzer/CMakeLists.txt",
			"cmake/modules/LLVM-Config.cmake",
			"cmake/modules/LLVM-Build.cmake",
			"lib/CMakeLists.txt",
			"lib/Support/CMakeLists.txt",
			"cmake/modules/HandleLLVMOptions.cmake",
			"CMakeLists.txt"
		],
		"nodes" : 
		[
			{
				"file" : 1
			},
			{
				"command" : 2,
				"file" : 1,
				"line" : 6,
				"parent" : 0
			},
			{
				"command" : 1,
				"file" : 0,
				"line" : 1450,
				"parent" : 1
			},
			{
				"command" : 0,
				"file" : 0,
				"line" : 969,
				"parent" : 2
			},
			{
				"command" : 5,
				"file" : 0,
				"line" : 1016,
				"parent" : 2
			},
			{
				"command" : 4,
				"file" : 2,
				"line" : 98,
				"parent" : 4
			},
			{
				"command" : 3,
				"file" : 2,
				"line" : 110,
				"parent" : 5
			},
			{
				"file" : 4
			},
			{
				"command" : 6,
				"file" : 4,
				"line" : 67,
				"parent" : 7
			},
			{
				"command" : 3,
				"file" : 3,
				"line" : 101,
				"parent" : 8
			},
			{
				"file" : 5
			},
			{
				"command" : 9,
				"file" : 5,
				"line" : 132,
				"parent" : 10
			},
			{
				"command" : 8,
				"file" : 0,
				"line" : 827,
				"parent" : 11
			},
			{
				"command" : 7,
				"file" : 0,
				"line" : 852,
				"parent" : 12
			},
			{
				"command" : 3,
				"file" : 0,
				"line" : 714,
				"parent" : 13
			},
			{
				"command" : 3,
				"file" : 3,
				"line" : 101,
				"parent" : 8
			},
			{
				"command" : 11,
				"file" : 0,
				"line" : 991,
				"parent" : 2
			},
			{
				"command" : 10,
				"file" : 0,
				"line" : 83,
				"parent" : 16
			},
			{
				"file" : 7
			},
			{
				"command" : 13,
				"file" : 7,
				"line" : 926,
				"parent" : 18
			},
			{
				"file" : 6,
				"parent" : 19
			},
			{
				"command" : 12,
				"file" : 6,
				"line" : 92,
				"parent" : 20
			},
			{
				"command" : 12,
				"file" : 6,
				"line" : 113,
				"parent" : 20
			},
			{
				"command" : 12,
				"file" : 6,
				"line" : 1053,
				"parent" : 20
			},
			{
				"command" : 12,
				"file" : 6,
				"line" : 1054,
				"parent" : 20
			},
			{
				"command" : 12,
				"file" : 6,
				"line" : 1055,
				"parent" : 20
			},
			{
				"command" : 14,
				"file" : 7,
				"line" : 1133,
				"parent" : 18
			}
		]
	},
	"compileGroups" : 
	[
		{
			"compileCommandFragments" : 
			[
				{
					"fragment" : " -fPIC -fvisibility-inlines-hidden -Werror=date-time -Werror=unguarded-availability-new -Wall -Wextra -Wno-unused-parameter -Wwrite-strings -Wcast-qual -Wmissing-field-initializers -pedantic -Wno-long-long -Wc++98-compat-extra-semi -Wimplicit-fallthrough -Wcovered-switch-default -Wno-noexcept-type -Wnon-virtual-dtor -Wdelete-non-virtual-dtor -Wsuggest-override -Wstring-conversion -Wmisleading-indentation -Wctad-maybe-unsupported -g -std=c++17 -arch arm64 -isysroot /Applications/Xcode.app/Contents/Developer/Platforms/MacOSX.platform/Developer/SDKs/MacOSX14.0.sdk"
				},
				{
					"fragment" : " -fno-exceptions -funwind-tables -fno-rtti"
				}
			],
			"defines" : 
			[
				{
					"backtrace" : 17,
					"define" : "GTEST_HAS_RTTI=0"
				},
				{
					"backtrace" : 21,
					"define" : "_DEBUG"
				},
				{
					"backtrace" : 22,
					"define" : "_GLIBCXX_ASSERTIONS"
				},
				{
					"backtrace" : 23,
					"define" : "__STDC_CONSTANT_MACROS"
				},
				{
					"backtrace" : 24,
					"define" : "__STDC_FORMAT_MACROS"
				},
				{
					"backtrace" : 25,
					"define" : "__STDC_LIMIT_MACROS"
				}
			],
			"includes" : 
			[
				{
					"path" : "/Users/jacsc/Code/install/llvm-build/tools/llvm-yaml-parser-fuzzer"
				},
				{
					"path" : "/Users/jacsc/Code/install/llvm-project/llvm/tools/llvm-yaml-parser-fuzzer"
				},
				{
					"backtrace" : 26,
					"path" : "/Users/jacsc/Code/install/llvm-build/include"
				},
				{
					"backtrace" : 26,
					"path" : "/Users/jacsc/Code/install/llvm-project/llvm/include"
				},
				{
					"backtrace" : 6,
					"isSystem" : true,
					"path" : "/opt/homebrew/include"
				}
			],
			"language" : "CXX",
			"languageStandard" : 
			{
				"backtraces" : 
				[
					3
				],
				"standard" : "17"
			},
			"sourceIndexes" : 
			[
				0,
				1
			]
		}
	],
	"dependencies" : 
	[
		{
			"backtrace" : 6,
			"id" : "LLVMDemangle::@3c7ef39cff93a35ba752"
		},
		{
			"backtrace" : 6,
			"id" : "LLVMSupport::@928d1708d80fe1f55e59"
		},
		{
			"backtrace" : 6,
			"id" : "LLVMFuzzerCLI::@5c563885927a2b6284fa"
		},
		{
			"backtrace" : 6,
			"id" : "LLVMTargetParser::@49fd776d486540152370"
		}
	],
	"folder" : 
	{
		"name" : "Fuzzers"
	},
	"id" : "llvm-yaml-parser-fuzzer::@fe27f8bab4b97f3d17ff",
	"link" : 
	{
		"commandFragments" : 
		[
			{
				"fragment" : "-fPIC -fvisibility-inlines-hidden -Werror=date-time -Werror=unguarded-availability-new -Wall -Wextra -Wno-unused-parameter -Wwrite-strings -Wcast-qual -Wmissing-field-initializers -pedantic -Wno-long-long -Wc++98-compat-extra-semi -Wimplicit-fallthrough -Wcovered-switch-default -Wno-noexcept-type -Wnon-virtual-dtor -Wdelete-non-virtual-dtor -Wsuggest-override -Wstring-conversion -Wmisleading-indentation -Wctad-maybe-unsupported -g",
				"role" : "flags"
			},
			{
				"fragment" : "-L/Users/jacsc/Code/install/ChezScheme/.build/lib -L/opt/homebrew/opt/llvm/lib",
				"role" : "flags"
			},
			{
				"fragment" : "-Wl,-rpath,@loader_path/../lib",
				"role" : "libraries"
			},
			{
				"backtrace" : 6,
				"fragment" : "../../lib/libLLVMSupport.a",
				"role" : "libraries"
			},
			{
				"backtrace" : 6,
				"fragment" : "../../lib/libLLVMFuzzerCLI.a",
				"role" : "libraries"
			},
			{
				"backtrace" : 9,
				"fragment" : "../../lib/libLLVMTargetParser.a",
				"role" : "libraries"
			},
			{
				"backtrace" : 6,
				"fragment" : "../../lib/libLLVMSupport.a",
				"role" : "libraries"
			},
			{
				"backtrace" : 14,
				"fragment" : "-lm",
				"role" : "libraries"
			},
			{
				"backtrace" : 14,
				"fragment" : "/Applications/Xcode.app/Contents/Developer/Platforms/MacOSX.platform/Developer/SDKs/MacOSX14.0.sdk/usr/lib/libz.tbd",
				"role" : "libraries"
			},
			{
				"backtrace" : 14,
				"fragment" : "/opt/homebrew/lib/libzstd.dylib",
				"role" : "libraries"
			},
			{
				"backtrace" : 14,
				"fragment" : "/Applications/Xcode.app/Contents/Developer/Platforms/MacOSX.platform/Developer/SDKs/MacOSX14.0.sdk/usr/lib/libcurses.tbd",
				"role" : "libraries"
			},
			{
				"backtrace" : 15,
				"fragment" : "../../lib/libLLVMDemangle.a",
				"role" : "libraries"
			}
		],
		"language" : "CXX"
	},
	"name" : "llvm-yaml-parser-fuzzer",
	"nameOnDisk" : "llvm-yaml-parser-fuzzer",
	"paths" : 
	{
		"build" : "tools/llvm-yaml-parser-fuzzer",
		"source" : "tools/llvm-yaml-parser-fuzzer"
	},
	"sourceGroups" : 
	[
		{
			"name" : "Source Files",
			"sourceIndexes" : 
			[
				0,
				1
			]
		}
	],
	"sources" : 
	[
		{
			"backtrace" : 3,
			"compileGroupIndex" : 0,
			"path" : "tools/llvm-yaml-parser-fuzzer/DummyYAMLParserFuzzer.cpp",
			"sourceGroupIndex" : 0
		},
		{
			"backtrace" : 3,
			"compileGroupIndex" : 0,
			"path" : "tools/llvm-yaml-parser-fuzzer/yaml-parser-fuzzer.cpp",
			"sourceGroupIndex" : 0
		}
	],
	"type" : "EXECUTABLE"
}
