{
	"archive" : {},
	"artifacts" : 
	[
		{
			"path" : "lib/libbenchmark_main.a"
		}
	],
	"backtrace" : 1,
	"backtraceGraph" : 
	{
		"commands" : 
		[
			"add_library",
			"target_link_libraries",
			"add_definitions",
			"cxx_feature_check",
			"add_compile_definitions",
			"include",
			"include_directories"
		],
		"files" : 
		[
			"/Users/jacsc/Code/install/llvm-project/third-party/benchmark/src/CMakeLists.txt",
			"/Users/jacsc/Code/install/llvm-project/third-party/benchmark/cmake/CXXFeatureCheck.cmake",
			"/Users/jacsc/Code/install/llvm-project/third-party/benchmark/CMakeLists.txt",
			"cmake/modules/HandleLLVMOptions.cmake",
			"CMakeLists.txt"
		],
		"nodes" : 
		[
			{
				"file" : 0
			},
			{
				"command" : 0,
				"file" : 0,
				"line" : 57,
				"parent" : 0
			},
			{
				"command" : 1,
				"file" : 0,
				"line" : 64,
				"parent" : 0
			},
			{
				"file" : 2
			},
			{
				"command" : 3,
				"file" : 2,
				"line" : 302,
				"parent" : 3
			},
			{
				"command" : 2,
				"file" : 1,
				"line" : 61,
				"parent" : 4
			},
			{
				"command" : 3,
				"file" : 2,
				"line" : 300,
				"parent" : 3
			},
			{
				"command" : 2,
				"file" : 1,
				"line" : 26,
				"parent" : 6
			},
			{
				"command" : 3,
				"file" : 2,
				"line" : 311,
				"parent" : 3
			},
			{
				"command" : 2,
				"file" : 1,
				"line" : 61,
				"parent" : 8
			},
			{
				"file" : 4
			},
			{
				"command" : 5,
				"file" : 4,
				"line" : 926,
				"parent" : 10
			},
			{
				"file" : 3,
				"parent" : 11
			},
			{
				"command" : 4,
				"file" : 3,
				"line" : 92,
				"parent" : 12
			},
			{
				"command" : 4,
				"file" : 3,
				"line" : 113,
				"parent" : 12
			},
			{
				"command" : 4,
				"file" : 3,
				"line" : 1053,
				"parent" : 12
			},
			{
				"command" : 4,
				"file" : 3,
				"line" : 1054,
				"parent" : 12
			},
			{
				"command" : 4,
				"file" : 3,
				"line" : 1055,
				"parent" : 12
			},
			{
				"command" : 6,
				"file" : 4,
				"line" : 1133,
				"parent" : 10
			},
			{
				"command" : 6,
				"file" : 2,
				"line" : 321,
				"parent" : 3
			}
		]
	},
	"compileGroups" : 
	[
		{
			"compileCommandFragments" : 
			[
				{
					"fragment" : " -fPIC -fvisibility-inlines-hidden -Werror=date-time -Werror=unguarded-availability-new -Wall -Wextra -Wno-unused-parameter -Wwrite-strings -Wcast-qual -Wmissing-field-initializers -pedantic -Wno-long-long -Wc++98-compat-extra-semi -Wimplicit-fallthrough -Wcovered-switch-default -Wno-noexcept-type -Wnon-virtual-dtor -Wdelete-non-virtual-dtor -Wsuggest-override -Wstring-conversion -Wmisleading-indentation -Wctad-maybe-unsupported  -std=c++11  -Wall  -Wextra  -Wshadow  -Wsuggest-override  -pedantic  -pedantic-errors  -Wshorten-64-to-32  -fstrict-aliasing  -Wno-deprecated-declarations  -fno-exceptions  -Wstrict-aliasing  -Wthread-safety -g -std=c++17 -arch arm64 -isysroot /Applications/Xcode.app/Contents/Developer/Platforms/MacOSX.platform/Developer/SDKs/MacOSX14.0.sdk"
				}
			],
			"defines" : 
			[
				{
					"backtrace" : 5,
					"define" : "HAVE_POSIX_REGEX"
				},
				{
					"backtrace" : 7,
					"define" : "HAVE_STD_REGEX"
				},
				{
					"backtrace" : 9,
					"define" : "HAVE_STEADY_CLOCK"
				},
				{
					"backtrace" : 13,
					"define" : "_DEBUG"
				},
				{
					"backtrace" : 14,
					"define" : "_GLIBCXX_ASSERTIONS"
				},
				{
					"backtrace" : 15,
					"define" : "__STDC_CONSTANT_MACROS"
				},
				{
					"backtrace" : 16,
					"define" : "__STDC_FORMAT_MACROS"
				},
				{
					"backtrace" : 17,
					"define" : "__STDC_LIMIT_MACROS"
				}
			],
			"includes" : 
			[
				{
					"path" : "/Users/jacsc/Code/install/llvm-build/third-party/benchmark/src"
				},
				{
					"path" : "/Users/jacsc/Code/install/llvm-project/third-party/benchmark/src"
				},
				{
					"backtrace" : 18,
					"path" : "/Users/jacsc/Code/install/llvm-build/include"
				},
				{
					"backtrace" : 18,
					"path" : "/Users/jacsc/Code/install/llvm-project/llvm/include"
				},
				{
					"backtrace" : 19,
					"path" : "/Users/jacsc/Code/install/llvm-project/third-party/benchmark/include"
				}
			],
			"language" : "CXX",
			"languageStandard" : 
			{
				"backtraces" : 
				[
					1
				],
				"standard" : "17"
			},
			"sourceIndexes" : 
			[
				0
			]
		}
	],
	"dependencies" : 
	[
		{
			"backtrace" : 2,
			"id" : "benchmark::@d4f64cf0f57ed78b9a8d"
		}
	],
	"id" : "benchmark_main::@d4f64cf0f57ed78b9a8d",
	"name" : "benchmark_main",
	"nameOnDisk" : "libbenchmark_main.a",
	"paths" : 
	{
		"build" : "third-party/benchmark/src",
		"source" : "/Users/jacsc/Code/install/llvm-project/third-party/benchmark/src"
	},
	"sourceGroups" : 
	[
		{
			"name" : "Source Files",
			"sourceIndexes" : 
			[
				0
			]
		}
	],
	"sources" : 
	[
		{
			"backtrace" : 1,
			"compileGroupIndex" : 0,
			"path" : "/Users/jacsc/Code/install/llvm-project/third-party/benchmark/src/benchmark_main.cc",
			"sourceGroupIndex" : 0
		}
	],
	"type" : "STATIC_LIBRARY"
}
