{
	"archive" : {},
	"artifacts" : 
	[
		{
			"path" : "lib/libllvm_gtest_main.a"
		}
	],
	"backtrace" : 3,
	"backtraceGraph" : 
	{
		"commands" : 
		[
			"add_library",
			"llvm_add_library",
			"add_llvm_library",
			"target_link_libraries",
			"add_definitions",
			"add_compile_definitions",
			"include",
			"include_directories"
		],
		"files" : 
		[
			"cmake/modules/AddLLVM.cmake",
			"/Users/jacsc/Code/install/llvm-project/third-party/unittest/UnitTestMain/CMakeLists.txt",
			"/Users/jacsc/Code/install/llvm-project/third-party/unittest/CMakeLists.txt",
			"cmake/modules/HandleLLVMOptions.cmake",
			"CMakeLists.txt"
		],
		"nodes" : 
		[
			{
				"file" : 1
			},
			{
				"command" : 2,
				"file" : 1,
				"line" : 6,
				"parent" : 0
			},
			{
				"command" : 1,
				"file" : 0,
				"line" : 852,
				"parent" : 1
			},
			{
				"command" : 0,
				"file" : 0,
				"line" : 590,
				"parent" : 2
			},
			{
				"command" : 3,
				"file" : 0,
				"line" : 714,
				"parent" : 2
			},
			{
				"file" : 2
			},
			{
				"command" : 4,
				"file" : 2,
				"line" : 35,
				"parent" : 5
			},
			{
				"file" : 4
			},
			{
				"command" : 6,
				"file" : 4,
				"line" : 926,
				"parent" : 7
			},
			{
				"file" : 3,
				"parent" : 8
			},
			{
				"command" : 5,
				"file" : 3,
				"line" : 92,
				"parent" : 9
			},
			{
				"command" : 5,
				"file" : 3,
				"line" : 113,
				"parent" : 9
			},
			{
				"command" : 5,
				"file" : 3,
				"line" : 1053,
				"parent" : 9
			},
			{
				"command" : 5,
				"file" : 3,
				"line" : 1054,
				"parent" : 9
			},
			{
				"command" : 5,
				"file" : 3,
				"line" : 1055,
				"parent" : 9
			},
			{
				"command" : 7,
				"file" : 4,
				"line" : 1133,
				"parent" : 7
			}
		]
	},
	"compileGroups" : 
	[
		{
			"compileCommandFragments" : 
			[
				{
					"fragment" : " -fPIC -fvisibility-inlines-hidden -Werror=date-time -Werror=unguarded-availability-new -Wall -Wextra -Wno-unused-parameter -Wwrite-strings -Wcast-qual -Wmissing-field-initializers -pedantic -Wno-long-long -Wc++98-compat-extra-semi -Wimplicit-fallthrough -Wcovered-switch-default -Wno-noexcept-type -Wnon-virtual-dtor -Wdelete-non-virtual-dtor -Wsuggest-override -Wstring-conversion -Wmisleading-indentation -Wctad-maybe-unsupported -g -std=c++17 -arch arm64 -isysroot /Applications/Xcode.app/Contents/Developer/Platforms/MacOSX.platform/Developer/SDKs/MacOSX14.0.sdk   -Wno-variadic-macros -Wno-gnu-zero-variadic-macro-arguments -Wno-covered-switch-default -Wno-suggest-override"
				},
				{
					"fragment" : " -fno-exceptions -funwind-tables"
				},
				{
					"backtrace" : 4,
					"fragment" : "-Wno-suggest-override"
				}
			],
			"defines" : 
			[
				{
					"backtrace" : 6,
					"define" : "GTEST_HAS_RTTI=0"
				},
				{
					"backtrace" : 10,
					"define" : "_DEBUG"
				},
				{
					"backtrace" : 11,
					"define" : "_GLIBCXX_ASSERTIONS"
				},
				{
					"backtrace" : 12,
					"define" : "__STDC_CONSTANT_MACROS"
				},
				{
					"backtrace" : 13,
					"define" : "__STDC_FORMAT_MACROS"
				},
				{
					"backtrace" : 14,
					"define" : "__STDC_LIMIT_MACROS"
				}
			],
			"includes" : 
			[
				{
					"path" : "/Users/jacsc/Code/install/llvm-build/third-party/unittest/UnitTestMain"
				},
				{
					"path" : "/Users/jacsc/Code/install/llvm-project/third-party/unittest/UnitTestMain"
				},
				{
					"backtrace" : 15,
					"path" : "/Users/jacsc/Code/install/llvm-build/include"
				},
				{
					"backtrace" : 15,
					"path" : "/Users/jacsc/Code/install/llvm-project/llvm/include"
				},
				{
					"backtrace" : 4,
					"path" : "/Users/jacsc/Code/install/llvm-project/third-party/unittest/googletest/include"
				},
				{
					"backtrace" : 4,
					"path" : "/Users/jacsc/Code/install/llvm-project/third-party/unittest/googlemock/include"
				},
				{
					"backtrace" : 4,
					"isSystem" : true,
					"path" : "/opt/homebrew/include"
				}
			],
			"language" : "CXX",
			"languageStandard" : 
			{
				"backtraces" : 
				[
					3
				],
				"standard" : "17"
			},
			"sourceIndexes" : 
			[
				0
			]
		}
	],
	"dependencies" : 
	[
		{
			"backtrace" : 4,
			"id" : "LLVMDemangle::@3c7ef39cff93a35ba752"
		},
		{
			"backtrace" : 4,
			"id" : "LLVMSupport::@928d1708d80fe1f55e59"
		},
		{
			"backtrace" : 4,
			"id" : "llvm_gtest::@0f58997ba806a3fe2530"
		}
	],
	"folder" : 
	{
		"name" : "Libraries"
	},
	"id" : "llvm_gtest_main::@6aed8c35274cf854cb51",
	"name" : "llvm_gtest_main",
	"nameOnDisk" : "libllvm_gtest_main.a",
	"paths" : 
	{
		"build" : "third-party/unittest/UnitTestMain",
		"source" : "/Users/jacsc/Code/install/llvm-project/third-party/unittest/UnitTestMain"
	},
	"sourceGroups" : 
	[
		{
			"name" : "Source Files",
			"sourceIndexes" : 
			[
				0
			]
		}
	],
	"sources" : 
	[
		{
			"backtrace" : 3,
			"compileGroupIndex" : 0,
			"path" : "/Users/jacsc/Code/install/llvm-project/third-party/unittest/UnitTestMain/TestMain.cpp",
			"sourceGroupIndex" : 0
		}
	],
	"type" : "STATIC_LIBRARY"
}
