{
	"artifacts" : 
	[
		{
			"path" : "lib/libRemarks.dylib"
		}
	],
	"backtrace" : 3,
	"backtraceGraph" : 
	{
		"commands" : 
		[
			"add_library",
			"llvm_add_library",
			"add_llvm_library",
			"install",
			"target_link_libraries",
			"LLVMBuildResolveComponentsLink",
			"add_llvm_component_library",
			"add_dependencies",
			"add_llvm_symbol_exports",
			"set_property",
			"llvm_update_compile_flags",
			"add_compile_definitions",
			"include",
			"include_directories"
		],
		"files" : 
		[
			"cmake/modules/AddLLVM.cmake",
			"tools/remarks-shlib/CMakeLists.txt",
			"cmake/modules/LLVM-Build.cmake",
			"lib/CMakeLists.txt",
			"lib/Support/CMakeLists.txt",
			"cmake/modules/HandleLLVMOptions.cmake",
			"CMakeLists.txt"
		],
		"nodes" : 
		[
			{
				"file" : 1
			},
			{
				"command" : 2,
				"file" : 1,
				"line" : 16,
				"parent" : 0
			},
			{
				"command" : 1,
				"file" : 0,
				"line" : 850,
				"parent" : 1
			},
			{
				"command" : 0,
				"file" : 0,
				"line" : 588,
				"parent" : 2
			},
			{
				"command" : 3,
				"file" : 0,
				"line" : 879,
				"parent" : 1
			},
			{
				"command" : 4,
				"file" : 0,
				"line" : 714,
				"parent" : 2
			},
			{
				"file" : 3
			},
			{
				"command" : 5,
				"file" : 3,
				"line" : 67,
				"parent" : 6
			},
			{
				"command" : 4,
				"file" : 2,
				"line" : 101,
				"parent" : 7
			},
			{
				"file" : 4
			},
			{
				"command" : 6,
				"file" : 4,
				"line" : 132,
				"parent" : 9
			},
			{
				"command" : 2,
				"file" : 0,
				"line" : 827,
				"parent" : 10
			},
			{
				"command" : 1,
				"file" : 0,
				"line" : 852,
				"parent" : 11
			},
			{
				"command" : 4,
				"file" : 0,
				"line" : 714,
				"parent" : 12
			},
			{
				"command" : 4,
				"file" : 2,
				"line" : 101,
				"parent" : 7
			},
			{
				"command" : 8,
				"file" : 0,
				"line" : 657,
				"parent" : 2
			},
			{
				"command" : 7,
				"file" : 0,
				"line" : 178,
				"parent" : 15
			},
			{
				"command" : 10,
				"file" : 0,
				"line" : 614,
				"parent" : 2
			},
			{
				"command" : 9,
				"file" : 0,
				"line" : 83,
				"parent" : 17
			},
			{
				"file" : 6
			},
			{
				"command" : 12,
				"file" : 6,
				"line" : 926,
				"parent" : 19
			},
			{
				"file" : 5,
				"parent" : 20
			},
			{
				"command" : 11,
				"file" : 5,
				"line" : 92,
				"parent" : 21
			},
			{
				"command" : 11,
				"file" : 5,
				"line" : 113,
				"parent" : 21
			},
			{
				"command" : 11,
				"file" : 5,
				"line" : 1053,
				"parent" : 21
			},
			{
				"command" : 11,
				"file" : 5,
				"line" : 1054,
				"parent" : 21
			},
			{
				"command" : 11,
				"file" : 5,
				"line" : 1055,
				"parent" : 21
			},
			{
				"command" : 13,
				"file" : 6,
				"line" : 1133,
				"parent" : 19
			}
		]
	},
	"compileGroups" : 
	[
		{
			"compileCommandFragments" : 
			[
				{
					"fragment" : " -fPIC -fvisibility-inlines-hidden -Werror=date-time -Werror=unguarded-availability-new -Wall -Wextra -Wno-unused-parameter -Wwrite-strings -Wcast-qual -Wmissing-field-initializers -pedantic -Wno-long-long -Wc++98-compat-extra-semi -Wimplicit-fallthrough -Wcovered-switch-default -Wno-noexcept-type -Wnon-virtual-dtor -Wdelete-non-virtual-dtor -Wsuggest-override -Wstring-conversion -Wmisleading-indentation -Wctad-maybe-unsupported -g -std=c++17 -arch arm64 -isysroot /Applications/Xcode.app/Contents/Developer/Platforms/MacOSX.platform/Developer/SDKs/MacOSX14.0.sdk -fPIC"
				},
				{
					"fragment" : " -fno-exceptions -funwind-tables -fno-rtti"
				}
			],
			"defines" : 
			[
				{
					"backtrace" : 18,
					"define" : "GTEST_HAS_RTTI=0"
				},
				{
					"backtrace" : 22,
					"define" : "_DEBUG"
				},
				{
					"backtrace" : 23,
					"define" : "_GLIBCXX_ASSERTIONS"
				},
				{
					"backtrace" : 24,
					"define" : "__STDC_CONSTANT_MACROS"
				},
				{
					"backtrace" : 25,
					"define" : "__STDC_FORMAT_MACROS"
				},
				{
					"backtrace" : 26,
					"define" : "__STDC_LIMIT_MACROS"
				}
			],
			"includes" : 
			[
				{
					"path" : "/Users/jacsc/Code/install/llvm-build/tools/remarks-shlib"
				},
				{
					"path" : "/Users/jacsc/Code/install/llvm-project/llvm/tools/remarks-shlib"
				},
				{
					"backtrace" : 27,
					"path" : "/Users/jacsc/Code/install/llvm-build/include"
				},
				{
					"backtrace" : 27,
					"path" : "/Users/jacsc/Code/install/llvm-project/llvm/include"
				},
				{
					"backtrace" : 5,
					"isSystem" : true,
					"path" : "/opt/homebrew/include"
				}
			],
			"language" : "CXX",
			"languageStandard" : 
			{
				"backtraces" : 
				[
					3
				],
				"standard" : "17"
			},
			"sourceIndexes" : 
			[
				0
			]
		}
	],
	"dependencies" : 
	[
		{
			"backtrace" : 5,
			"id" : "LLVMDemangle::@3c7ef39cff93a35ba752"
		},
		{
			"backtrace" : 5,
			"id" : "LLVMSupport::@928d1708d80fe1f55e59"
		},
		{
			"backtrace" : 5,
			"id" : "LLVMBitstreamReader::@95731b79b16df93229d4"
		},
		{
			"backtrace" : 5,
			"id" : "LLVMRemarks::@6a63c042d04b6deafc56"
		},
		{
			"backtrace" : 16,
			"id" : "Remarks_exports::@f7dec6e8b9f0a1fc96de"
		}
	],
	"folder" : 
	{
		"name" : "Libraries"
	},
	"id" : "Remarks::@f7dec6e8b9f0a1fc96de",
	"install" : 
	{
		"destinations" : 
		[
			{
				"backtrace" : 4,
				"path" : "lib"
			},
			{
				"backtrace" : 4,
				"path" : "lib"
			}
		],
		"prefix" : 
		{
			"path" : "/usr/local"
		}
	},
	"link" : 
	{
		"commandFragments" : 
		[
			{
				"fragment" : "-L/Users/jacsc/Code/install/ChezScheme/.build/lib -L/opt/homebrew/opt/llvm/lib   -Wl,-exported_symbols_list,\"/Users/jacsc/Code/install/llvm-build/tools/remarks-shlib/Remarks.exports\" -compatibility_version 1 -current_version 18.0.0",
				"role" : "flags"
			},
			{
				"fragment" : "-Wl,-rpath,@loader_path/../lib",
				"role" : "libraries"
			},
			{
				"backtrace" : 5,
				"fragment" : "../../lib/libLLVMRemarks.a",
				"role" : "libraries"
			},
			{
				"backtrace" : 8,
				"fragment" : "../../lib/libLLVMBitstreamReader.a",
				"role" : "libraries"
			},
			{
				"backtrace" : 8,
				"fragment" : "../../lib/libLLVMSupport.a",
				"role" : "libraries"
			},
			{
				"backtrace" : 13,
				"fragment" : "-lm",
				"role" : "libraries"
			},
			{
				"backtrace" : 13,
				"fragment" : "/Applications/Xcode.app/Contents/Developer/Platforms/MacOSX.platform/Developer/SDKs/MacOSX14.0.sdk/usr/lib/libz.tbd",
				"role" : "libraries"
			},
			{
				"backtrace" : 13,
				"fragment" : "/opt/homebrew/lib/libzstd.dylib",
				"role" : "libraries"
			},
			{
				"backtrace" : 13,
				"fragment" : "/Applications/Xcode.app/Contents/Developer/Platforms/MacOSX.platform/Developer/SDKs/MacOSX14.0.sdk/usr/lib/libcurses.tbd",
				"role" : "libraries"
			},
			{
				"backtrace" : 14,
				"fragment" : "../../lib/libLLVMDemangle.a",
				"role" : "libraries"
			}
		],
		"language" : "CXX"
	},
	"name" : "Remarks",
	"nameOnDisk" : "libRemarks.dylib",
	"paths" : 
	{
		"build" : "tools/remarks-shlib",
		"source" : "tools/remarks-shlib"
	},
	"sourceGroups" : 
	[
		{
			"name" : "Source Files",
			"sourceIndexes" : 
			[
				0
			]
		}
	],
	"sources" : 
	[
		{
			"backtrace" : 3,
			"compileGroupIndex" : 0,
			"path" : "tools/remarks-shlib/libremarks.cpp",
			"sourceGroupIndex" : 0
		}
	],
	"type" : "SHARED_LIBRARY"
}
