{
	"artifacts" : 
	[
		{
			"path" : "lib/LLVMHello.dylib"
		}
	],
	"backtrace" : 3,
	"backtraceGraph" : 
	{
		"commands" : 
		[
			"add_library",
			"llvm_add_library",
			"add_llvm_library",
			"add_dependencies",
			"add_llvm_symbol_exports",
			"set_property",
			"llvm_update_compile_flags",
			"add_compile_definitions",
			"include",
			"include_directories"
		],
		"files" : 
		[
			"cmake/modules/AddLLVM.cmake",
			"lib/Transforms/Hello/CMakeLists.txt",
			"cmake/modules/HandleLLVMOptions.cmake",
			"CMakeLists.txt"
		],
		"nodes" : 
		[
			{
				"file" : 1
			},
			{
				"command" : 2,
				"file" : 1,
				"line" : 13,
				"parent" : 0
			},
			{
				"command" : 1,
				"file" : 0,
				"line" : 848,
				"parent" : 1
			},
			{
				"command" : 0,
				"file" : 0,
				"line" : 585,
				"parent" : 2
			},
			{
				"command" : 3,
				"file" : 0,
				"line" : 721,
				"parent" : 2
			},
			{
				"command" : 4,
				"file" : 0,
				"line" : 657,
				"parent" : 2
			},
			{
				"command" : 3,
				"file" : 0,
				"line" : 178,
				"parent" : 5
			},
			{
				"command" : 6,
				"file" : 0,
				"line" : 614,
				"parent" : 2
			},
			{
				"command" : 5,
				"file" : 0,
				"line" : 83,
				"parent" : 7
			},
			{
				"file" : 3
			},
			{
				"command" : 8,
				"file" : 3,
				"line" : 926,
				"parent" : 9
			},
			{
				"file" : 2,
				"parent" : 10
			},
			{
				"command" : 7,
				"file" : 2,
				"line" : 92,
				"parent" : 11
			},
			{
				"command" : 7,
				"file" : 2,
				"line" : 113,
				"parent" : 11
			},
			{
				"command" : 7,
				"file" : 2,
				"line" : 1053,
				"parent" : 11
			},
			{
				"command" : 7,
				"file" : 2,
				"line" : 1054,
				"parent" : 11
			},
			{
				"command" : 7,
				"file" : 2,
				"line" : 1055,
				"parent" : 11
			},
			{
				"command" : 9,
				"file" : 3,
				"line" : 1133,
				"parent" : 9
			}
		]
	},
	"compileGroups" : 
	[
		{
			"compileCommandFragments" : 
			[
				{
					"fragment" : " -fPIC -fvisibility-inlines-hidden -Werror=date-time -Werror=unguarded-availability-new -Wall -Wextra -Wno-unused-parameter -Wwrite-strings -Wcast-qual -Wmissing-field-initializers -pedantic -Wno-long-long -Wc++98-compat-extra-semi -Wimplicit-fallthrough -Wcovered-switch-default -Wno-noexcept-type -Wnon-virtual-dtor -Wdelete-non-virtual-dtor -Wsuggest-override -Wstring-conversion -Wmisleading-indentation -Wctad-maybe-unsupported -g -std=c++17 -arch arm64 -isysroot /Applications/Xcode.app/Contents/Developer/Platforms/MacOSX.platform/Developer/SDKs/MacOSX14.0.sdk -fPIC"
				},
				{
					"fragment" : " -fno-exceptions -funwind-tables -fno-rtti"
				}
			],
			"defines" : 
			[
				{
					"backtrace" : 8,
					"define" : "GTEST_HAS_RTTI=0"
				},
				{
					"backtrace" : 12,
					"define" : "_DEBUG"
				},
				{
					"backtrace" : 13,
					"define" : "_GLIBCXX_ASSERTIONS"
				},
				{
					"backtrace" : 14,
					"define" : "__STDC_CONSTANT_MACROS"
				},
				{
					"backtrace" : 15,
					"define" : "__STDC_FORMAT_MACROS"
				},
				{
					"backtrace" : 16,
					"define" : "__STDC_LIMIT_MACROS"
				}
			],
			"includes" : 
			[
				{
					"path" : "/Users/jacsc/Code/install/llvm-build/lib/Transforms/Hello"
				},
				{
					"path" : "/Users/jacsc/Code/install/llvm-project/llvm/lib/Transforms/Hello"
				},
				{
					"backtrace" : 17,
					"path" : "/Users/jacsc/Code/install/llvm-build/include"
				},
				{
					"backtrace" : 17,
					"path" : "/Users/jacsc/Code/install/llvm-project/llvm/include"
				}
			],
			"language" : "CXX",
			"languageStandard" : 
			{
				"backtraces" : 
				[
					3
				],
				"standard" : "17"
			},
			"sourceIndexes" : 
			[
				0
			]
		}
	],
	"dependencies" : 
	[
		{
			"backtrace" : 4,
			"id" : "intrinsics_gen::@6eda0283a7d1115d7bbd"
		},
		{
			"backtrace" : 6,
			"id" : "LLVMHello_exports::@48ed1eff02c32f32e24c"
		}
	],
	"folder" : 
	{
		"name" : "Loadable modules"
	},
	"id" : "LLVMHello::@48ed1eff02c32f32e24c",
	"link" : 
	{
		"commandFragments" : 
		[
			{
				"fragment" : "-L/Users/jacsc/Code/install/ChezScheme/.build/lib -L/opt/homebrew/opt/llvm/lib -Wl,-flat_namespace -Wl,-undefined -Wl,suppress   -Wl,-exported_symbols_list,\"/Users/jacsc/Code/install/llvm-build/lib/Transforms/Hello/LLVMHello.exports\"",
				"role" : "flags"
			},
			{
				"fragment" : "-Wl,-rpath,@loader_path/../lib",
				"role" : "libraries"
			}
		],
		"language" : "CXX"
	},
	"name" : "LLVMHello",
	"nameOnDisk" : "LLVMHello.dylib",
	"paths" : 
	{
		"build" : "lib/Transforms/Hello",
		"source" : "lib/Transforms/Hello"
	},
	"sourceGroups" : 
	[
		{
			"name" : "Source Files",
			"sourceIndexes" : 
			[
				0
			]
		}
	],
	"sources" : 
	[
		{
			"backtrace" : 3,
			"compileGroupIndex" : 0,
			"path" : "lib/Transforms/Hello/Hello.cpp",
			"sourceGroupIndex" : 0
		}
	],
	"type" : "MODULE_LIBRARY"
}
