{
	"archive" : {},
	"artifacts" : 
	[
		{
			"path" : "lib/libLLVMWindowsDriver.a"
		}
	],
	"backtrace" : 4,
	"backtraceGraph" : 
	{
		"commands" : 
		[
			"add_library",
			"llvm_add_library",
			"add_llvm_library",
			"add_llvm_component_library",
			"install",
			"target_link_libraries",
			"LLVMBuildResolveComponentsLink",
			"set_property",
			"llvm_update_compile_flags",
			"add_compile_definitions",
			"include",
			"include_directories"
		],
		"files" : 
		[
			"cmake/modules/AddLLVM.cmake",
			"lib/WindowsDriver/CMakeLists.txt",
			"cmake/modules/LLVM-Build.cmake",
			"lib/CMakeLists.txt",
			"cmake/modules/HandleLLVMOptions.cmake",
			"CMakeLists.txt"
		],
		"nodes" : 
		[
			{
				"file" : 1
			},
			{
				"command" : 3,
				"file" : 1,
				"line" : 1,
				"parent" : 0
			},
			{
				"command" : 2,
				"file" : 0,
				"line" : 827,
				"parent" : 1
			},
			{
				"command" : 1,
				"file" : 0,
				"line" : 852,
				"parent" : 2
			},
			{
				"command" : 0,
				"file" : 0,
				"line" : 590,
				"parent" : 3
			},
			{
				"command" : 4,
				"file" : 0,
				"line" : 879,
				"parent" : 2
			},
			{
				"file" : 3
			},
			{
				"command" : 6,
				"file" : 3,
				"line" : 67,
				"parent" : 6
			},
			{
				"command" : 5,
				"file" : 2,
				"line" : 101,
				"parent" : 7
			},
			{
				"command" : 8,
				"file" : 0,
				"line" : 614,
				"parent" : 3
			},
			{
				"command" : 7,
				"file" : 0,
				"line" : 83,
				"parent" : 9
			},
			{
				"file" : 5
			},
			{
				"command" : 10,
				"file" : 5,
				"line" : 926,
				"parent" : 11
			},
			{
				"file" : 4,
				"parent" : 12
			},
			{
				"command" : 9,
				"file" : 4,
				"line" : 92,
				"parent" : 13
			},
			{
				"command" : 9,
				"file" : 4,
				"line" : 113,
				"parent" : 13
			},
			{
				"command" : 9,
				"file" : 4,
				"line" : 1053,
				"parent" : 13
			},
			{
				"command" : 9,
				"file" : 4,
				"line" : 1054,
				"parent" : 13
			},
			{
				"command" : 9,
				"file" : 4,
				"line" : 1055,
				"parent" : 13
			},
			{
				"command" : 11,
				"file" : 5,
				"line" : 1133,
				"parent" : 11
			}
		]
	},
	"compileGroups" : 
	[
		{
			"compileCommandFragments" : 
			[
				{
					"fragment" : " -fPIC -fvisibility-inlines-hidden -Werror=date-time -Werror=unguarded-availability-new -Wall -Wextra -Wno-unused-parameter -Wwrite-strings -Wcast-qual -Wmissing-field-initializers -pedantic -Wno-long-long -Wc++98-compat-extra-semi -Wimplicit-fallthrough -Wcovered-switch-default -Wno-noexcept-type -Wnon-virtual-dtor -Wdelete-non-virtual-dtor -Wsuggest-override -Wstring-conversion -Wmisleading-indentation -Wctad-maybe-unsupported -g -std=c++17 -arch arm64 -isysroot /Applications/Xcode.app/Contents/Developer/Platforms/MacOSX.platform/Developer/SDKs/MacOSX14.0.sdk"
				},
				{
					"fragment" : " -fno-exceptions -funwind-tables -fno-rtti"
				}
			],
			"defines" : 
			[
				{
					"backtrace" : 10,
					"define" : "GTEST_HAS_RTTI=0"
				},
				{
					"backtrace" : 14,
					"define" : "_DEBUG"
				},
				{
					"backtrace" : 15,
					"define" : "_GLIBCXX_ASSERTIONS"
				},
				{
					"backtrace" : 16,
					"define" : "__STDC_CONSTANT_MACROS"
				},
				{
					"backtrace" : 17,
					"define" : "__STDC_FORMAT_MACROS"
				},
				{
					"backtrace" : 18,
					"define" : "__STDC_LIMIT_MACROS"
				}
			],
			"includes" : 
			[
				{
					"path" : "/Users/jacsc/Code/install/llvm-build/lib/WindowsDriver"
				},
				{
					"path" : "/Users/jacsc/Code/install/llvm-project/llvm/lib/WindowsDriver"
				},
				{
					"backtrace" : 19,
					"path" : "/Users/jacsc/Code/install/llvm-build/include"
				},
				{
					"backtrace" : 19,
					"path" : "/Users/jacsc/Code/install/llvm-project/llvm/include"
				},
				{
					"backtrace" : 8,
					"isSystem" : true,
					"path" : "/opt/homebrew/include"
				}
			],
			"language" : "CXX",
			"languageStandard" : 
			{
				"backtraces" : 
				[
					4
				],
				"standard" : "17"
			},
			"sourceIndexes" : 
			[
				0
			]
		}
	],
	"dependencies" : 
	[
		{
			"backtrace" : 8,
			"id" : "LLVMDemangle::@3c7ef39cff93a35ba752"
		},
		{
			"backtrace" : 8,
			"id" : "LLVMSupport::@928d1708d80fe1f55e59"
		},
		{
			"backtrace" : 8,
			"id" : "LLVMOption::@03597dd37d3dc3b95065"
		},
		{
			"backtrace" : 8,
			"id" : "LLVMTargetParser::@49fd776d486540152370"
		}
	],
	"folder" : 
	{
		"name" : "Libraries"
	},
	"id" : "LLVMWindowsDriver::@67e0b031e165bff462f4",
	"install" : 
	{
		"destinations" : 
		[
			{
				"backtrace" : 5,
				"path" : "lib"
			}
		],
		"prefix" : 
		{
			"path" : "/usr/local"
		}
	},
	"name" : "LLVMWindowsDriver",
	"nameOnDisk" : "libLLVMWindowsDriver.a",
	"paths" : 
	{
		"build" : "lib/WindowsDriver",
		"source" : "lib/WindowsDriver"
	},
	"sourceGroups" : 
	[
		{
			"name" : "Source Files",
			"sourceIndexes" : 
			[
				0
			]
		},
		{
			"name" : "Header Files",
			"sourceIndexes" : 
			[
				1,
				2
			]
		}
	],
	"sources" : 
	[
		{
			"backtrace" : 4,
			"compileGroupIndex" : 0,
			"path" : "lib/WindowsDriver/MSVCPaths.cpp",
			"sourceGroupIndex" : 0
		},
		{
			"backtrace" : 4,
			"path" : "include/llvm/WindowsDriver/MSVCPaths.h",
			"sourceGroupIndex" : 1
		},
		{
			"backtrace" : 4,
			"path" : "include/llvm/WindowsDriver/MSVCSetupApi.h",
			"sourceGroupIndex" : 1
		}
	],
	"type" : "STATIC_LIBRARY"
}
